,url,segment_no,cumle_icerigi,kelime_sayısı
435,https://www.haberler.com/egil-kaymakami-idris-arslan-vefa-sosyal-destek-13221534-haberi/,0,Diyarbakır ın Eğil Kaymakamı Belediye Başkan Vekili İdris Arslan ilçede görev yapan Vefa Sosyal Destek Grubu ekiplerinin yardım çalışmalarına katıldı Eğil Kaymakamı Belediye Başkan Vekili İdris Arslan Vefa Sosyal Destek Grubu ekipleriyle beraber korona virüs mücadelesi kapsamında sokağa çıkma yasağı getirilen yaş üstü kronik rahatsızlığı bulunan vatandaşları evlerinde ziyaret etti,50
436,https://www.haberler.com/egil-kaymakami-idris-arslan-vefa-sosyal-destek-13221534-haberi/,1,Kaymakam Arslan ziyaret ettiği vatandaşlara Cumhurbaşkanı Recep Tayyip Erdoğan ın selamlarını iletip durumları hakkında bilgi aldı,16
437,https://www.haberler.com/egil-kaymakami-idris-arslan-vefa-sosyal-destek-13221534-haberi/,2,Devletin zaman vatandaşının yanında olduğunu belirten Arslan zorlu süreci el birliğiyle atlatacaklarını söyledi,13
438,https://www.haberler.com/egil-kaymakami-idris-arslan-vefa-sosyal-destek-13221534-haberi/,3,DİYARBAKIRKaynak İHA,2
439,https://www.haberler.com/tff-1-inci-lig-de-zirve-yarisi-kizisacak-13221531-haberi/,0,TFF inci Lig de Süper Lig yarışı kümede kalma mücadelesi çekişmeli geçecek,12
440,https://www.haberler.com/tff-1-inci-lig-de-zirve-yarisi-kizisacak-13221531-haberi/,1,Zirve takım iddiasını sürdürürken kalan haftada ekipler kaderlerini çizecek,9
441,https://www.haberler.com/tff-1-inci-lig-de-zirve-yarisi-kizisacak-13221531-haberi/,2,Ligin ilk sırasının Süper Lig vizesi alacağı ligde sonraki sıra Süper Lig şansını Play Off ta deneyecek Türkiye Futbol Federasyonu TFF koronavirüs pandemisi nedeniyle ara verilen TFF inci Lig in Haziran Cuma günü başlayacağını duyurdu,35
442,https://www.haberler.com/tff-1-inci-lig-de-zirve-yarisi-kizisacak-13221531-haberi/,3,Ligdeki ekipler kendi tesislerinde kalan haftanın hazırlıklarına başladı,8
443,https://www.haberler.com/tff-1-inci-lig-de-zirve-yarisi-kizisacak-13221531-haberi/,4,haftası geride kalan ligde şampiyonluk yarışı kümede kalma mücadelesi nefes kesecek,11
444,https://www.haberler.com/tff-1-inci-lig-de-zirve-yarisi-kizisacak-13221531-haberi/,5,Süper Lig yolunda ilk sıradaki ekipler iddiasını korurken kalan maçlarda kaderlerini çizecek,12
445,https://www.haberler.com/tff-1-inci-lig-de-zirve-yarisi-kizisacak-13221531-haberi/,6,Ligin kalan bölümünde maçlar önce olduğu kulüplerin bir maçı üzerinden ilerlediği takdir sezonun Temmuz da son bulması bekleniyor,18
446,https://www.haberler.com/tff-1-inci-lig-de-zirve-yarisi-kizisacak-13221531-haberi/,7,Hafta içi oynanacak maçlar sürenin kısaltılması gündemdeki yerini koruyor,9
447,https://www.haberler.com/tff-1-inci-lig-de-zirve-yarisi-kizisacak-13221531-haberi/,8,AMANSIZ YARIŞTFF inci Lig de mevcut süreç Hatayspor un liderliğinde geçiliyor,11
448,https://www.haberler.com/tff-1-inci-lig-de-zirve-yarisi-kizisacak-13221531-haberi/,9,puanlı Hatay temsilcisi yakın rakibinin puan önünde şampiyonluk ciddi bir avantaja sahip,12
449,https://www.haberler.com/tff-1-inci-lig-de-zirve-yarisi-kizisacak-13221531-haberi/,10,Ancak nci basamaktaki Altay liderin puan gerisinde olmasına karşın Süper Lig iddiasını sürdürüyor,13
450,https://www.haberler.com/tff-1-inci-lig-de-zirve-yarisi-kizisacak-13221531-haberi/,11,Büyükşehir Belediye Erzurumspor puanla nci basamakta yer alırken bir puan gerisinde Bursaspor üncü sırada takibini sürdürüyor,16
451,https://www.haberler.com/tff-1-inci-lig-de-zirve-yarisi-kizisacak-13221531-haberi/,12,Akabinde sıralanan Adana Demirspor Akhisarspor er puana sahipken ncı sıradaki Fatih Karagümrük averajla gerisindeki Altay ın er puanı bulunuyor ATEŞ HATTIKüme düşme hattında Boluspor ateş hattının yalnızca bir puan üzerinde yer alıyor,32
452,https://www.haberler.com/tff-1-inci-lig-de-zirve-yarisi-kizisacak-13221531-haberi/,13,ncı sıradaki Osmanlıspor bir basamak üzerindeki Boluspor puana sahip,9
453,https://www.haberler.com/tff-1-inci-lig-de-zirve-yarisi-kizisacak-13221531-haberi/,14,üncü sıradaki Altınordu puanla ateş hattının puan önünde nispeten rahat bir konumda bulunuyor,13
454,https://www.haberler.com/tff-1-inci-lig-de-zirve-yarisi-kizisacak-13221531-haberi/,15,Ligin son basamağındaki Eskişehirspor puanla ligde kalma umutlarını mucizelere bırakırken nci Adanaspor puana sahip ligde kalma umutlarını sürdürmek kalan maçlarından mutlak galibiyet çıkarmak zorunda Ligin geride kalan haftalarında oldukça zorlu maçlar görülecek,32
455,https://www.haberler.com/tff-1-inci-lig-de-zirve-yarisi-kizisacak-13221531-haberi/,16,uncu haftada Altay Akhisarspor ilk arasındaki Cesar Grup Ümraniyespor Fatih Karagümrük maçları öne çıkıyor aynı hafta alt sıralarda Boluspor Altınordu maçı oynanacak İşte şampiyonluk adaylarının kalan maçları ligdeki sıralamalar HATAYSPOR İstanbulspor Balıkesirspor Boluspor Keçiörengücü Adanaspor Bursaspor BB ERZURUMSPOR Eskişehirspor Osmanlspor Adana Demirspor Giresunspor Altay CG Ümraniyespor BURSASPOR Keçiörengücü Adanaspor Giresunspor Altınordu EG Menemenspor Hatayspor ADANA DEMİRSPOR Osmanlıspor Giresunspor BB Erzurumspor Altay CG Ümraniyespor İstanbulspor AKHİSARSPOR Altay CG Ümraniyespor İstanbulspor EH Balıkesirspor Boluspor Keçiörengücü FATİH KARAGÜMRÜK CG Ümraniyespor İstanbulspor EH Balıkesirspor Boluspor Keçiörengücü Adanaspor ALTAY Akhisarspor Eskişehirspor Osmanlıspor Adana Demirspor BB Erzurumspor Giresunspor TFF inci Lig de Süper Lig yarışı kümede kalma mücadelesi çekişmeli geçecek,104
456,https://www.haberler.com/tff-1-inci-lig-de-zirve-yarisi-kizisacak-13221531-haberi/,1,Zirve takım iddiasını sürdürürken kalan haftada ekipler kaderlerini çizecek,9
457,https://www.haberler.com/tff-1-inci-lig-de-zirve-yarisi-kizisacak-13221531-haberi/,2,Ligin ilk sırasının Süper Lig vizesi alacağı ligde sonraki sıra Süper Lig şansını Play Off ta deneyecek Türkiye Futbol Federasyonu TFF koronavirüs pandemisi nedeniyle ara verilen TFF inci Lig in Haziran Cuma günü başlayacağını duyurdu,35
458,https://www.haberler.com/tff-1-inci-lig-de-zirve-yarisi-kizisacak-13221531-haberi/,3,Ligdeki ekipler kendi tesislerinde kalan haftanın hazırlıklarına başladı,8
459,https://www.haberler.com/tff-1-inci-lig-de-zirve-yarisi-kizisacak-13221531-haberi/,4,haftası geride kalan ligde şampiyonluk yarışı kümede kalma mücadelesi nefes kesecek,11
460,https://www.haberler.com/tff-1-inci-lig-de-zirve-yarisi-kizisacak-13221531-haberi/,5,Süper Lig yolunda ilk sıradaki ekipler iddiasını korurken kalan maçlarda kaderlerini çizecek,12
461,https://www.haberler.com/tff-1-inci-lig-de-zirve-yarisi-kizisacak-13221531-haberi/,6,Ligin kalan bölümünde maçlar önce olduğu kulüplerin bir maçı üzerinden ilerlediği takdir sezonun Temmuz da son bulması bekleniyor,18
462,https://www.haberler.com/tff-1-inci-lig-de-zirve-yarisi-kizisacak-13221531-haberi/,7,Hafta içi oynanacak maçlar sürenin kısaltılması gündemdeki yerini koruyor,9
463,https://www.haberler.com/tff-1-inci-lig-de-zirve-yarisi-kizisacak-13221531-haberi/,8,AMANSIZ YARIŞTFF inci Lig de mevcut süreç Hatayspor un liderliğinde geçiliyor,11
464,https://www.haberler.com/tff-1-inci-lig-de-zirve-yarisi-kizisacak-13221531-haberi/,9,puanlı Hatay temsilcisi yakın rakibinin puan önünde şampiyonluk ciddi bir avantaja sahip,12
465,https://www.haberler.com/tff-1-inci-lig-de-zirve-yarisi-kizisacak-13221531-haberi/,10,Ancak nci basamaktaki Altay liderin puan gerisinde olmasına karşın Süper Lig iddiasını sürdürüyor,13
466,https://www.haberler.com/tff-1-inci-lig-de-zirve-yarisi-kizisacak-13221531-haberi/,11,Büyükşehir Belediye Erzurumspor puanla nci basamakta yer alırken bir puan gerisinde Bursaspor üncü sırada takibini sürdürüyor,16
467,https://www.haberler.com/tff-1-inci-lig-de-zirve-yarisi-kizisacak-13221531-haberi/,12,Akabinde sıralanan Adana Demirspor Akhisarspor er puana sahipken ncı sıradaki Fatih Karagümrük averajla gerisindeki Altay ın er puanı bulunuyor ATEŞ HATTIKüme düşme hattında Boluspor ateş hattının yalnızca bir puan üzerinde yer alıyor,32
468,https://www.haberler.com/tff-1-inci-lig-de-zirve-yarisi-kizisacak-13221531-haberi/,13,ncı sıradaki Osmanlıspor bir basamak üzerindeki Boluspor puana sahip,9
469,https://www.haberler.com/tff-1-inci-lig-de-zirve-yarisi-kizisacak-13221531-haberi/,14,üncü sıradaki Altınordu puanla ateş hattının puan önünde nispeten rahat bir konumda bulunuyor,13
470,https://www.haberler.com/tff-1-inci-lig-de-zirve-yarisi-kizisacak-13221531-haberi/,15,Ligin son basamağındaki Eskişehirspor puanla ligde kalma umutlarını mucizelere bırakırken nci Adanaspor puana sahip ligde kalma umutlarını sürdürmek kalan maçlarından mutlak galibiyet çıkarmak zorunda Ligin geride kalan haftalarında oldukça zorlu maçlar görülecek,32
471,https://www.haberler.com/tff-1-inci-lig-de-zirve-yarisi-kizisacak-13221531-haberi/,32,uncu haftada Altay Akhisarspor ilk arasındaki Cesar Grup Ümraniyespor Fatih Karagümrük maçları öne çıkıyor aynı hafta alt sıralarda Boluspor Altınordu maçı oynanacak İşte şampiyonluk adaylarının kalan maçları ligdeki sıralamalar Türkiye Futbol Federasyonu TFF koronavirüs pandemisi nedeniyle ara verilen TFF inci Lig in Haziran Cuma günü başlayacağını duyurdu,47
472,https://www.haberler.com/tff-1-inci-lig-de-zirve-yarisi-kizisacak-13221531-haberi/,3,Ligdeki ekipler kendi tesislerinde kalan haftanın hazırlıklarına başladı,8
473,https://www.haberler.com/tff-1-inci-lig-de-zirve-yarisi-kizisacak-13221531-haberi/,4,haftası geride kalan ligde şampiyonluk yarışı kümede kalma mücadelesi nefes kesecek,11
474,https://www.haberler.com/tff-1-inci-lig-de-zirve-yarisi-kizisacak-13221531-haberi/,5,Süper Lig yolunda ilk sıradaki ekipler iddiasını korurken kalan maçlarda kaderlerini çizecek,12
475,https://www.haberler.com/tff-1-inci-lig-de-zirve-yarisi-kizisacak-13221531-haberi/,6,Ligin kalan bölümünde maçlar önce olduğu kulüplerin bir maçı üzerinden ilerlediği takdir sezonun Temmuz da son bulması bekleniyor,18
476,https://www.haberler.com/tff-1-inci-lig-de-zirve-yarisi-kizisacak-13221531-haberi/,7,Hafta içi oynanacak maçlar sürenin kısaltılması gündemdeki yerini koruyor,9
477,https://www.haberler.com/tff-1-inci-lig-de-zirve-yarisi-kizisacak-13221531-haberi/,38,HATAYSPOR İstanbulspor Balıkesirspor Boluspor Keçiörengücü Adanaspor Bursaspor BB ERZURUMSPOR Eskişehirspor Osmanlspor Adana Demirspor Giresunspor Altay CG Ümraniyespor BURSASPOR Keçiörengücü Adanaspor Giresunspor Altınordu EG Menemenspor Hatayspor ADANA DEMİRSPOR Osmanlıspor Giresunspor BB Erzurumspor Altay CG Ümraniyespor İstanbulspor AKHİSARSPOR Altay CG Ümraniyespor İstanbulspor EH Balıkesirspor Boluspor Keçiörengücü FATİH KARAGÜMRÜK CG Ümraniyespor İstanbulspor EH Balıkesirspor Boluspor Keçiörengücü Adanaspor ALTAY Akhisarspor Eskişehirspor Osmanlıspor Adana Demirspor BB Erzurumspor Giresunspor Kaynak DHA,65
478,https://www.haberler.com/belcika-da-son-24-saatte-koronavirusten-60-olum-13221529-haberi/,0,Belçika da son saatte koronavirüs Covid nedeniyle kişi hayatını kaybetti,10
479,https://www.haberler.com/belcika-da-son-24-saatte-koronavirusten-60-olum-13221529-haberi/,1,Ülkede toplam can kaybı bin yükseldi Belçika da son saatte koronavirüs Covid nedeniyle kişi hayatını kaybetti,16
480,https://www.haberler.com/belcika-da-son-24-saatte-koronavirusten-60-olum-13221529-haberi/,2,Ülkede toplam can kaybı bin yükseldi,6
481,https://www.haberler.com/antalya-da-tam-izolasyonlu-tatilin-adresi-13221528-haberi/,0,Antalya da korona virüs salgını sebebiyle sosyal mesafeye göre park ettikleri karavanlarında denize sıfır izole yaşam sürdüren karavancılar gider su bağlantıları olmadığı sıkıntı yaşadıklarını dile getirerek belediyeden karavan park talebinde bulundu Dünyaca ünlü Konyaaltı sahili kıyısına yakın bir bölgede nin üzerinde karavanda sosyal mesafe kuralına uygun bir hayat yaşanıyor,49
482,https://www.haberler.com/antalya-da-tam-izolasyonlu-tatilin-adresi-13221528-haberi/,1,Araçlarını er metre mesafe aralığında park eden vatandaşlar apartman yaşamından uzak deniz manzaralı bir bölgede korona virüse karşı izole yaşam sürdürüyor,21
483,https://www.haberler.com/antalya-da-tam-izolasyonlu-tatilin-adresi-13221528-haberi/,2,Karavanlarına kapanan vatandaşlar elektriği karavanlarının üzerlerindeki panellerinden elde ettikleri güneş enerjisiyle suyu yakın bölgedeki çeşmelerden depolarına su doldurarak temin ediyorlar,20
484,https://www.haberler.com/antalya-da-tam-izolasyonlu-tatilin-adresi-13221528-haberi/,3,En büyük sıkıntılarının tuvalet ihtiyacı su olduğunu söyleyen karavancılar herhangi bir gider su bağlantıları olmadığı sıkıntı yaşadıklarını dile getirdiler,19
485,https://www.haberler.com/antalya-da-tam-izolasyonlu-tatilin-adresi-13221528-haberi/,4,Karavancılar belediyeden karavan park talebinde bulundu,6
486,https://www.haberler.com/antalya-da-tam-izolasyonlu-tatilin-adresi-13221528-haberi/,5,Şehir hayatına göre huzurlu bir hayat Korona virüs tedbirleri kapsamında alınan seyahat kısıtlaması öncesinde Ankara dan Antalya ya gelen Gözde Gürer kısıtlamayla birlikte aydır kentte kaldığını söyledi,27
487,https://www.haberler.com/antalya-da-tam-izolasyonlu-tatilin-adresi-13221528-haberi/,6,Karavan hayatında bireysel izolasyonun ön planda olduğuna dikkat çeken Gürer Zaten karavanlarda sosyal mesafeye kuralına göre park ediliyor,18
488,https://www.haberler.com/antalya-da-tam-izolasyonlu-tatilin-adresi-13221528-haberi/,7,Gün içerisinde çiçek ekerek kitap okuyarak vakit geçiriyoruz,8
489,https://www.haberler.com/antalya-da-tam-izolasyonlu-tatilin-adresi-13221528-haberi/,8,Şehir hayatına göre huzurlu bir hayat dedi Ev yaşamına göre karavan hayatının eksiklikleri olduğuna değinen Gürer Limitli eşya kullanıyorsunuz,19
490,https://www.haberler.com/antalya-da-tam-izolasyonlu-tatilin-adresi-13221528-haberi/,9,Kullandığınız elektrik su limitli,4
491,https://www.haberler.com/antalya-da-tam-izolasyonlu-tatilin-adresi-13221528-haberi/,10,O yüzden evlerdeki rahat değilsiniz,5
492,https://www.haberler.com/antalya-da-tam-izolasyonlu-tatilin-adresi-13221528-haberi/,11,Az eşyayla yaşamak zor tabii,5
493,https://www.haberler.com/antalya-da-tam-izolasyonlu-tatilin-adresi-13221528-haberi/,12,Güneş panelinden elektrik sağlıyorum,4
494,https://www.haberler.com/antalya-da-tam-izolasyonlu-tatilin-adresi-13221528-haberi/,13,Suyu depolarım var onlarla çevreden tedarik ediyorum ifadesini kullandı Karavan park talebiAnkara dan ay önce kente gelen İsmail Akdağ tam zamanlı olarak karavanda yaşamını sürdürdüğünü ifade etti,27
495,https://www.haberler.com/antalya-da-tam-izolasyonlu-tatilin-adresi-13221528-haberi/,14,Karavanda bir evde yaşıyor gibiyiz diyen Akdağ büyük sıkıntılarının tuvalet su olduğunu söyledi,13
496,https://www.haberler.com/antalya-da-tam-izolasyonlu-tatilin-adresi-13221528-haberi/,15,Akdağ Devamlı dışarıdan su taşımak suyu idareli kullanmak zorundasınız,9
497,https://www.haberler.com/antalya-da-tam-izolasyonlu-tatilin-adresi-13221528-haberi/,16,Belediyeler bize karavan park alanı yapsalar,6
498,https://www.haberler.com/antalya-da-tam-izolasyonlu-tatilin-adresi-13221528-haberi/,17,Sonuçta bizler karavanlara sigorta vergi ödeyen insanlarız,7
499,https://www.haberler.com/antalya-da-tam-izolasyonlu-tatilin-adresi-13221528-haberi/,18,En azından belediyelerin karavancılara tahsis etmiş olduğu bir yer olsa karavancılar gidip sokak aralarında boş arsalarda kalmasa,17
500,https://www.haberler.com/antalya-da-tam-izolasyonlu-tatilin-adresi-13221528-haberi/,19,Bu alanda duş tuvalet yok,5
501,https://www.haberler.com/antalya-da-tam-izolasyonlu-tatilin-adresi-13221528-haberi/,20,Bir gider yok,3
502,https://www.haberler.com/antalya-da-tam-izolasyonlu-tatilin-adresi-13221528-haberi/,21,Biz bunları karşılamak karavanlarımızı buradan kaldırıp başka yerlere giderek ihtiyaçlarımızı gideriyoruz ardından tekrar buraya geliyoruz,15
503,https://www.haberler.com/antalya-da-tam-izolasyonlu-tatilin-adresi-13221528-haberi/,22,Sonuçta bunlar bizim zorunlu bir ihtiyaç,6
504,https://www.haberler.com/antalya-da-tam-izolasyonlu-tatilin-adresi-13221528-haberi/,23,Karavanların atık su deposu dolduğu zaman gidip boşaltıp tekrar geliyoruz,10
505,https://www.haberler.com/antalya-da-tam-izolasyonlu-tatilin-adresi-13221528-haberi/,24,Tuvaleti duşu olmayan karavanlar var,5
506,https://www.haberler.com/antalya-da-tam-izolasyonlu-tatilin-adresi-13221528-haberi/,25,Örneğin benim karavanımda banyo var ancak tuvalet yok,8
507,https://www.haberler.com/antalya-da-tam-izolasyonlu-tatilin-adresi-13221528-haberi/,26,Yakında akaryakıt istasyonu var oraya gidiyoruz,6
508,https://www.haberler.com/antalya-da-tam-izolasyonlu-tatilin-adresi-13221528-haberi/,27,Duşumuzu burada kendimiz halledebiliyoruz bir yandan su sıkıntısı oluyor,9
509,https://www.haberler.com/antalya-da-tam-izolasyonlu-tatilin-adresi-13221528-haberi/,28,Avrupa da karavan park alanlarında direkt senin giderlerini bağlıyorlar su elektrik girişleri oluyor,13
510,https://www.haberler.com/antalya-da-tam-izolasyonlu-tatilin-adresi-13221528-haberi/,29,Böylece standart ev moduna geçmiş oluyorsunuz konuştu,7
511,https://www.haberler.com/antalya-da-tam-izolasyonlu-tatilin-adresi-13221528-haberi/,30,Birlikte iftar sahur yapıyoruz Güvenlik yönünden herhangi bir sıkıntılarının olmadığını dile getiren Akdağ Burada karavancılar birlikte olduğumuz birbirimize göz kulak oluyoruz,21
512,https://www.haberler.com/antalya-da-tam-izolasyonlu-tatilin-adresi-13221528-haberi/,31,Karşı karavanda bir tencere çorba kaynasa bize bir tas geliyor,10
513,https://www.haberler.com/antalya-da-tam-izolasyonlu-tatilin-adresi-13221528-haberi/,32,Akşamları karavanların önünde çayımızı kahvemizi içiyoruz,6
514,https://www.haberler.com/antalya-da-tam-izolasyonlu-tatilin-adresi-13221528-haberi/,33,Hatta birlikte iftar sahur yapıyoruz dedi,6
515,https://www.haberler.com/antalya-da-tam-izolasyonlu-tatilin-adresi-13221528-haberi/,34,ANTALYAKaynak İHA,2
516,https://www.haberler.com/yeni-tip-koronaviruse-cizgi-filmli-tedbir-13221527-haberi/,0,Çizgi film animasyonu Yeni tip koronavirüse çizgi filmli tedbirYeni tip koronavirüs Kovid salgınına karşı alınacak tedbirleri çocuklara eğlenceli olarak anlatmak animasyon film yapıldı Ela Korona nın mücadelesini konu alan filmde maske takma sabun kullanma kolonya evde kal konular anlatılıyor,39
517,https://www.haberler.com/yeni-tip-koronaviruse-cizgi-filmli-tedbir-13221527-haberi/,1,Animanya Animasyon Stüdyosunda bir aylık yoğun çalışmayla tamamlanan filmin yönetmeni Hüseyin Öztürk Bu zorlu süreçte insanların morale ihtiyacı var,19
518,https://www.haberler.com/yeni-tip-koronaviruse-cizgi-filmli-tedbir-13221527-haberi/,2,İzleyenleri biraz gülümsetebilmek konuya eğlenceli bir biçimde dikkat çekmek istedik dedi Kaynak AA,13
519,https://www.haberler.com/iran-da-son-24-saatte-korona-virusten-71-kisi-oldu-13221525-haberi/,0,İran da son saatte korona virüs nedeniyle kişinin hayatını kaybetmesi sonucu salgında ölenlerin sayısının bin vaka sayısının bin yükseldiği belirtildi İran Sağlık Bakanlığı Sözcüsü Kiyanuş Cihanpur ülkedeki korona virüs vakalarına ilişkin son istatistikleri paylaştı,34
520,https://www.haberler.com/iran-da-son-24-saatte-korona-virusten-71-kisi-oldu-13221525-haberi/,1,Son saatte bin kişinin korona virüs testlerinin pozitif çıktığını söyleyen Cihanpur salgın nedeniyle kişinin hayatını kaybettiğini ifade etti,18
521,https://www.haberler.com/iran-da-son-24-saatte-korona-virusten-71-kisi-oldu-13221525-haberi/,2,Cihanpur son verilerle birlikte ülkedeki toplam onaylanmış vaka sayısının bin ölenlerin sayısının bin yükseldiğini açıkladı Ülkede toplam bin hastanın virüsü yenerek taburcu olduğunu aktaran Cihanpur bin kişinin durumunun ağır olduğunu yoğun bakımda tedavi gördüğünü belirtti,35
522,https://www.haberler.com/iran-da-son-24-saatte-korona-virusten-71-kisi-oldu-13221525-haberi/,3,Aynur Sena Çabuk İHA Kaynak İHA,6
523,https://www.haberler.com/pazarda-yogunluk-var-sosyal-mesafe-hice-sayildi-13221524-haberi/,0,Bursa da günlük sokağa çıkma kısıtlaması öncesi vatandaşlar semt pazarına giderek ihtiyaçlarını gidermek alışveriş yapıyor,15
524,https://www.haberler.com/pazarda-yogunluk-var-sosyal-mesafe-hice-sayildi-13221524-haberi/,1,Pazarda yoğunluk yaşanırken sosyal mesafenin hiçe sayıldığı görüldü Korona virüs salgını kapsamında Türkiye de tedbirler devam ediyor,17
525,https://www.haberler.com/pazarda-yogunluk-var-sosyal-mesafe-hice-sayildi-13221524-haberi/,2,Bu kapsamda sokağa çıkma kısıtlaması yaşanacak,6
526,https://www.haberler.com/pazarda-yogunluk-var-sosyal-mesafe-hice-sayildi-13221524-haberi/,3,gün sürecek olan kısıtlama nedeniyle vatandaşlar semt pazarlarına yoğun ilgi gösteriyor,11
527,https://www.haberler.com/pazarda-yogunluk-var-sosyal-mesafe-hice-sayildi-13221524-haberi/,4,Pazarlara alışveriş yapmaya gelenler önce dezenfekte tünelinden geçtikten sonra içeriye alınıyor maskesi olmayanları zabıta ekipleri tarafından maske veriliyor Sağlık Bakanı Fahrettin Koca nın sıklıkla vurgu yaptığı maske takılması sosyal mesafe konusunun yanı sıra kalabalık ortamlardan fazla bulunmaması çağrısı dikkat çekmişti Üzüm yaprağı almak isteyen kadınların bir anda şeyi unutarak alışveriş yapması dikkat çekerken satıcının sosyal mesafe konusuna dikkat edilip edilmediği sorusuna verdiği cevap pes dedirtti Bayram öncesi satışına izin verilen giyim züccaciye çiçek ürünlere talep olduğu öğrenildi,77
528,https://www.haberler.com/pazarda-yogunluk-var-sosyal-mesafe-hice-sayildi-13221524-haberi/,5,BURSAKaynak İHA,2
529,https://www.haberler.com/taksi-icerisinde-dehset-veren-dakikalar-bicak-zoru-13221523-haberi/,0,İstanbul da bir taksiye binen kimliği belirsiz kişi taksi şoförüne dehşeti yaşattı,12
530,https://www.haberler.com/taksi-icerisinde-dehset-veren-dakikalar-bicak-zoru-13221523-haberi/,1,Yanında bulunan bıçağı şoförün karnına dayayan şüpheli şoförün cebindeki paraları gasp etti,12
531,https://www.haberler.com/taksi-icerisinde-dehset-veren-dakikalar-bicak-zoru-13221523-haberi/,2,Dehşet anları taksinin güvenlik kamerası tarafından saniye saniye kaydedildi Olay Arnavutköy Boğazköy yolunda meydana geldi,15
532,https://www.haberler.com/taksi-icerisinde-dehset-veren-dakikalar-bicak-zoru-13221523-haberi/,3,Eyüpsultan ilçesinden taksiye binen kimliği belirsiz kişi taksi şoförüne Arnavutköy gideceğini söyledi,12
533,https://www.haberler.com/taksi-icerisinde-dehset-veren-dakikalar-bicak-zoru-13221523-haberi/,4,Taksi Arnavutköy Boğazköy yolunun ormanlık kısmına geldiği anda arkada oturan şahıs yanındaki bıçağı şoförün karnına dayadı,16
534,https://www.haberler.com/taksi-icerisinde-dehset-veren-dakikalar-bicak-zoru-13221523-haberi/,5,Yaşadıkları karşısında şoke olan taksi şoförü şahsın kendisini tehdit etmesi üzerine cebinde bulunan paraları çıkararak verdi,16
535,https://www.haberler.com/taksi-icerisinde-dehset-veren-dakikalar-bicak-zoru-13221523-haberi/,6,Taksi şoförüne dehşeti yaşatan şahıs paraları aldıktan sonra taksiden inerek hızla olay yerinden kaçtı,14
536,https://www.haberler.com/taksi-icerisinde-dehset-veren-dakikalar-bicak-zoru-13221523-haberi/,7,Polis ekipleri kaçan şüphelinin yakalanması çalışma başlattı Öte yanan dehşet veren anlar taksinin içerisinde bulunan kamera tarafından saniye saniye kaydedildi,20
537,https://www.haberler.com/taksi-icerisinde-dehset-veren-dakikalar-bicak-zoru-13221523-haberi/,8,Görüntülerde önce şahsın aracın arkasına oturduğu bir süre sonra cebinden bıçağını çıkararak şoförün karnına dayadığı görülüyor,16
538,https://www.haberler.com/taksi-icerisinde-dehset-veren-dakikalar-bicak-zoru-13221523-haberi/,9,Korkusu yüzünden okunan şoför cebinde bulunan paraları saldırgana veriyor,9
539,https://www.haberler.com/taksi-icerisinde-dehset-veren-dakikalar-bicak-zoru-13221523-haberi/,10,İHA Kaynak İHA,3
540,https://www.haberler.com/mantar-toplamaya-gittigi-dagda-kaybolan-kisinin-13221522-haberi/,0,Kahramanmaraş ın Elbistan ilçesinde mantar toplamak gittiği dağda kaybolan kişinin cesedi bulundu Dün sabah saatlerinde mantar toplamak Kızılcaoba Mahallesi Taşoluk mevkisinden dağa çıkan yaşındaki Memiş Yanık eve dönmeyince yakınları durumu güvenlik güçlerine bildirdi Dağa tırmanan jandarma Elbistan Offroad Kulübü Elbistan Arama Kurtarma Derneği ELKUD üyelerinden oluşan ekipler Yanık bulmak seferber oldu Üçerli gruplar halinde arama yapan ekipler Yanık ulaşmaya çalıştı,60
541,https://www.haberler.com/mantar-toplamaya-gittigi-dagda-kaybolan-kisinin-13221522-haberi/,1,Sahur vaktinde ara verilen arama çalışması sabahın ilk ışıklarıyla yeniden başladı Yanık ın önce beraber mantar toplamaya giden arkadaşları arama kurtarma çalışmasını katıldı,23
542,https://www.haberler.com/mantar-toplamaya-gittigi-dagda-kaybolan-kisinin-13221522-haberi/,2,Bu kişiler Yanık Taşburun Mahallesi Işıklar mevkisindeki kayalıklar üzerinde hareketsiz bir şekilde yatarken buldu Haber verilmesi üzerine bölgeye jandarma sağlık ekipleri yönlendirildi,22
