,url,segment_no,cumle_icerigi,kelime_sayısı
213,https://www.haberler.com/karantina-sureci-biten-vatandaslardan-geriye-13221552-haberi/,4,Mektuba isminin Çetin olduğunu yazan bir vatandaş duygularını satırlarla anlattı gün karantinada tutulmak üzere Kütahya ya geldim,17
214,https://www.haberler.com/karantina-sureci-biten-vatandaslardan-geriye-13221552-haberi/,5,Ben Kütahya Dumlupınar Üniversitesi mezunuyum,5
215,https://www.haberler.com/karantina-sureci-biten-vatandaslardan-geriye-13221552-haberi/,6,Güzel Sanatlar Fakültesi Seramik Cam bölümünden ikincilikle mezun oldum,9
216,https://www.haberler.com/karantina-sureci-biten-vatandaslardan-geriye-13221552-haberi/,7,Yıllar sonra Kütahya ya şekilde gelmek tabii aklımın ucundan bile geçmezdi,11
217,https://www.haberler.com/karantina-sureci-biten-vatandaslardan-geriye-13221552-haberi/,8,Zaman neler getirir neler gösterir bilinmiyor,6
218,https://www.haberler.com/karantina-sureci-biten-vatandaslardan-geriye-13221552-haberi/,9,Dünyayla birlikte ülkemizi saran virüs inşallah kısa zamanda son bulur,10
219,https://www.haberler.com/karantina-sureci-biten-vatandaslardan-geriye-13221552-haberi/,10,Karantina sürecinde yurt oda şartları gayet güzel düzenlenmiş,8
220,https://www.haberler.com/karantina-sureci-biten-vatandaslardan-geriye-13221552-haberi/,11,gün boyunca emeği geçen herkese teşekkür ederim,7
221,https://www.haberler.com/karantina-sureci-biten-vatandaslardan-geriye-13221552-haberi/,12,Bizler çalıştınız yoruldunuz hakkınızı helal edin,6
222,https://www.haberler.com/karantina-sureci-biten-vatandaslardan-geriye-13221552-haberi/,13,C Blok numaralı odada kaldığım süreçte kağıtlarını kullandığım arkadaş hakkını helal etsin,12
223,https://www.haberler.com/karantina-sureci-biten-vatandaslardan-geriye-13221552-haberi/,14,Adı sanırım Ertuğrul Koca bana ulaşırsa sevinirim,7
224,https://www.haberler.com/karantina-sureci-biten-vatandaslardan-geriye-13221552-haberi/,15,Yurt müdürlüğüne Kızılay AFAD teşekkürler,5
225,https://www.haberler.com/karantina-sureci-biten-vatandaslardan-geriye-13221552-haberi/,16,İzzettin Aydın Servet Bulut un mektupları diğer isimsiz mektup notlarda teşekkür ifadeleri yer aldı Kaynak AA,16
226,https://www.haberler.com/engelli-rabia-dan-biz-bize-yeteriz-turkiyem-13221551-haberi/,0,Erzincanlı engelli Rabia Zeytun Cumhurbaşkanı Recep Tayyip Erdoğan ın Biz Bize Yeteriz Türkiyem sloganıyla başlattığı Milli Dayanışma Kampanyası na kumbarasındaki parayı bağışlayarak destek oldu Erzincan Aile Çalışma Sosyal Hizmetler İl Müdürlüğünden yapılan açıklamaya göre İl Müdürü Muhammet Doğan Mayıs Engelliler Haftası kapsamında kentteki engelli çocukları evinde ziyaret ederek onlara çeşitli hediyeler verdi Doğan ziyaretleri çerçevesinde zihinsel engelli Rabia Zeytun un evine giderek çeşitli hediyeler armağan etti Rabia Zeytun un annesi Nazlı Zeytun sırada kızının isteğiyle kumbarasındaki parasını Biz Bize Yeteriz Türkiyem sloganıyla yürütülen kampanyaya bağışlanması Doğan teslim etti Doğan parayı teslim alıp Rabia Zeytun Biz özel bir günde gelerek seni ziyaret ettik sen bize hediyelerin güzelini verdin,107
227,https://www.haberler.com/engelli-rabia-dan-biz-bize-yeteriz-turkiyem-13221551-haberi/,1,ifadelerini kullandı Para kampanya hesabına yatırıldı makbuzu Rabia Zeytun teslim edildi Kaynak AA,13
228,https://www.haberler.com/avrupa-ilac-ajansi-kovid-19-asisinin-uretimi-en-az-13221550-haberi/,0,Avrupa İlaç Ajansı EMA yeni tip koronavirüs Kovid aşısı hazihazırda çalışmanın yürütüldüğünü aşının toplu üretime hazır hale gelmesinin yılı bulacağını duyurdu Merkezi Hollanda nın Amsterdam kentinde bulunan EMA dan yapılan yazılı açıklamada Kovid tedavisinde kullanılacak ilaç aşılara ilişkin bilgiler paylaşıldı Açıklamada aşı tarih vermenin zor olduğu belirtilerek başarı sağlayan bir aşının toplu üretime geçmesi yıl gerektiğinin altı çizildi Kovid tedavisinde kullanılacak farklı ilaç araştırmasının yakından takip edildiği vurgulanan açıklamada Remdesivir adlı antiviral ilacın içinde bulunduğu ilaçlar klinik denemelerin başladığı kaydedildi Klinik denemelerin ardından sayıdaki gönüllü sağlıklı denek üzerinde ilaçların güvenli olup olmadığı olası yan etkileri incelenecek Avrupa Birliği AB genelinde insan hayvanlara ilişkin ilaç piyasasını düzenleyen EMA aynı zamanda ilaçların piyasaya sunulup sunulmayacağına karar veriyor te Londra da kurulan Ajans İngiltere nin AB den ayrılmasının ardından Amsterdam taşınmıştı Kaynak AA,130
229,https://www.haberler.com/sorgun-belediyesi-copleri-kaynaginda-ayristirmak-13221549-haberi/,0,Sorgun Belediyesi Atatürk Bulvarı Cumhuriyet Caddesi ndeki çöp konteynerlerini kaldırarak yerine atık toplama kutuları koydu Belediye Başkanı Mustafa Erkut Ekinci sürdürülebilir kalkınma ilkeleri çerçevesinde atıkların kontrol altına alınması hedefiyle Cumhurbaşkanlığı tarafından hazırlanan Sıfır Atık Yönetimi Eylem Planı na Sorgun Belediyesi olarak tam destek verdiklerini belirtti Başlatılan yeni uygulamayla Atatürk Bulvarı Cumhuriyet Caddesi ndeki çöp konteynerleri kaldırıldıklarını aktaran Ekinci Konteyner yerine atıkların kaynağında ayrışmasını sağlayan metal cam plastik kağıt evsel atık kutularının yer aldığı sıfır atık toplama noktaları oluşturuldu,78
230,https://www.haberler.com/sorgun-belediyesi-copleri-kaynaginda-ayristirmak-13221549-haberi/,1,dedi Ekinci Sorgun halkının uygulamaya sıcak bakacağından emin olduğunu vurgulayarak Yaşadığımız yeri korumak gelecek nesillere güzel bir çevre bırakmak elimizden geleni yapıyoruz,22
231,https://www.haberler.com/sorgun-belediyesi-copleri-kaynaginda-ayristirmak-13221549-haberi/,2,Bugüne kadar elli ton atık kağıdı geri dönüşüme gönderdik,9
232,https://www.haberler.com/sorgun-belediyesi-copleri-kaynaginda-ayristirmak-13221549-haberi/,3,Burada amacımız atıkları kaynağında ayrıştırmak geri dönüşüm yararlı hale getirmek,10
233,https://www.haberler.com/sorgun-belediyesi-copleri-kaynaginda-ayristirmak-13221549-haberi/,4,Sorgunlu hemşehrilerimin ambalaj atıklarını uygun kutulara atarak projeye destek vermelerini temenni ediyorum,12
234,https://www.haberler.com/sorgun-belediyesi-copleri-kaynaginda-ayristirmak-13221549-haberi/,5,konuştu Kaynak AA,3
235,https://www.haberler.com/nigde-de-kiraz-bahcelerine-akdeniz-meyve-sinegi-13221548-haberi/,0,NİĞDE Tarım Orman İl Müdürlüğü ekipleri kirazın yoğun olarak yetiştiği Ulukışla ilçesinde bulunan kiraz bahçelerine Akdeniz meyve sineği tuzağı yerleştirdi,20
236,https://www.haberler.com/nigde-de-kiraz-bahcelerine-akdeniz-meyve-sinegi-13221548-haberi/,1,Tarım Orman İl Müdürü Asım Baş kirazın Niğde nin önemli ihraç kalemlerinden olduğunu belirtti,14
237,https://www.haberler.com/nigde-de-kiraz-bahcelerine-akdeniz-meyve-sinegi-13221548-haberi/,2,Baş Hastalık zararlı yönden üretimi riske etmemek tedbirimizi alıyoruz,9
238,https://www.haberler.com/nigde-de-kiraz-bahcelerine-akdeniz-meyve-sinegi-13221548-haberi/,3,Arkadaşlarımız sürekli sahadalar,3
239,https://www.haberler.com/nigde-de-kiraz-bahcelerine-akdeniz-meyve-sinegi-13221548-haberi/,4,Akdeniz meyve sineğiyle ilgili tedbir amaçlı çalışmalar yapıyoruz,8
240,https://www.haberler.com/nigde-de-kiraz-bahcelerine-akdeniz-meyve-sinegi-13221548-haberi/,5,Birinci derecede riskli alanda değiliz Mersin Adana sınır olduğumuz kontrol tedbir amaçlı çalışmalarımızı sürdürüyoruz,14
241,https://www.haberler.com/nigde-de-kiraz-bahcelerine-akdeniz-meyve-sinegi-13221548-haberi/,6,Tuzak asımlarımız devam ediyor,4
242,https://www.haberler.com/nigde-de-kiraz-bahcelerine-akdeniz-meyve-sinegi-13221548-haberi/,7,Tuzaklardan ilaçlama zamanını tespit etmiş oluyoruz,6
243,https://www.haberler.com/nigde-de-kiraz-bahcelerine-akdeniz-meyve-sinegi-13221548-haberi/,8,Daha sonra ilaçlama ilanları vereceğiz,5
244,https://www.haberler.com/nigde-de-kiraz-bahcelerine-akdeniz-meyve-sinegi-13221548-haberi/,9,Bu sene kirazda inşallah Çin pazarına gireceğiz,7
245,https://www.haberler.com/nigde-de-kiraz-bahcelerine-akdeniz-meyve-sinegi-13221548-haberi/,10,Üreticimiz açısından ciddi anlamda getirisi yüksek bir pozisyon elde edilmiş olacak dedi Elma patateste olduğu Niğde yi kirazda merkez haline getirmeyi hedeflediklerini anlatan Asım Baş kentte son turfanda kiraz hasadı yapıldığı fiyatının tatmin edici olduğunu söyledi,36
246,https://www.haberler.com/nigde-de-kiraz-bahcelerine-akdeniz-meyve-sinegi-13221548-haberi/,11,Baş aynı zamanda ürünün yüksek yerlerde yetiştiği tadı aromasının güzel olduğunu kaydetti,12
247,https://www.haberler.com/nigde-de-kiraz-bahcelerine-akdeniz-meyve-sinegi-13221548-haberi/,0,NİĞDE Tarım Orman İl Müdürlüğü ekipleri kirazın yoğun olarak yetiştiği Ulukışla ilçesinde bulunan kiraz bahçelerine Akdeniz meyve sineği tuzağı yerleştirdi,20
248,https://www.haberler.com/nigde-de-kiraz-bahcelerine-akdeniz-meyve-sinegi-13221548-haberi/,1,Tarım Orman İl Müdürü Asım Baş kirazın Niğde nin önemli ihraç kalemlerinden olduğunu belirtti,14
249,https://www.haberler.com/nigde-de-kiraz-bahcelerine-akdeniz-meyve-sinegi-13221548-haberi/,2,Baş Hastalık zararlı yönden üretimi riske etmemek tedbirimizi alıyoruz,9
250,https://www.haberler.com/nigde-de-kiraz-bahcelerine-akdeniz-meyve-sinegi-13221548-haberi/,3,Arkadaşlarımız sürekli sahadalar,3
251,https://www.haberler.com/nigde-de-kiraz-bahcelerine-akdeniz-meyve-sinegi-13221548-haberi/,4,Akdeniz meyve sineğiyle ilgili tedbir amaçlı çalışmalar yapıyoruz,8
252,https://www.haberler.com/nigde-de-kiraz-bahcelerine-akdeniz-meyve-sinegi-13221548-haberi/,5,Birinci derecede riskli alanda değiliz Mersin Adana sınır olduğumuz kontrol tedbir amaçlı çalışmalarımızı sürdürüyoruz,14
253,https://www.haberler.com/nigde-de-kiraz-bahcelerine-akdeniz-meyve-sinegi-13221548-haberi/,6,Tuzak asımlarımız devam ediyor,4
254,https://www.haberler.com/nigde-de-kiraz-bahcelerine-akdeniz-meyve-sinegi-13221548-haberi/,7,Tuzaklardan ilaçlama zamanını tespit etmiş oluyoruz,6
255,https://www.haberler.com/nigde-de-kiraz-bahcelerine-akdeniz-meyve-sinegi-13221548-haberi/,8,Daha sonra ilaçlama ilanları vereceğiz,5
256,https://www.haberler.com/nigde-de-kiraz-bahcelerine-akdeniz-meyve-sinegi-13221548-haberi/,9,Bu sene kirazda inşallah Çin pazarına gireceğiz,7
257,https://www.haberler.com/nigde-de-kiraz-bahcelerine-akdeniz-meyve-sinegi-13221548-haberi/,10,Üreticimiz açısından ciddi anlamda getirisi yüksek bir pozisyon elde edilmiş olacak dedi Elma patateste olduğu Niğde yi kirazda merkez haline getirmeyi hedeflediklerini anlatan Asım Baş kentte son turfanda kiraz hasadı yapıldığı fiyatının tatmin edici olduğunu söyledi,36
258,https://www.haberler.com/nigde-de-kiraz-bahcelerine-akdeniz-meyve-sinegi-13221548-haberi/,11,Baş aynı zamanda ürünün yüksek yerlerde yetiştiği tadı aromasının güzel olduğunu kaydetti,12
259,https://www.haberler.com/nigde-de-kiraz-bahcelerine-akdeniz-meyve-sinegi-13221548-haberi/,24,Elma patateste olduğu Niğde yi kirazda merkez haline getirmeyi hedeflediklerini anlatan Asım Baş kentte son turfanda kiraz hasadı yapıldığı fiyatının tatmin edici olduğunu söyledi,24
260,https://www.haberler.com/nigde-de-kiraz-bahcelerine-akdeniz-meyve-sinegi-13221548-haberi/,25,Baş aynı zamanda ürünün yüksek yerlerde yetiştiği tadı aromasının güzel olduğunu kaydetti Kaynak DHA,14
261,https://www.haberler.com/kutahya-da-ciftcilere-yaglik-aycicegi-ve-dane-13221545-haberi/,0,Kütahya İl Tarım Orman Müdürlüğünce Bitkisel Üretimin Geliştirilmesi Programı kapsamında yüzde hibe olmak üzere bin dekar alanda yağlık ayçiçeği tohumu dekar alan dane mısır tohumunun çiftçilere teslim edildiği bildirildi İl Tarım Orman Müdürü Orhan Özçalık Bakanlık tarafından ekilebilir arazileri üretime kazandırmak Bitkisel Üretimin Geliştirilmesi Programı kapsamında yazlık ekim yapılabilecek alanlarda ekilişlerin kesintiye uğramaması ekilebilir arazilerin üretime katılması üreticilere tohumların yüzde ini hibe ederek ilde bin dekar alanda yağlık ayçiçeği tohumu dekar alan dane mısır tohumunun çiftçilere teslim edildiğini belirtti Özçalık Program doğrultusunda mevcut üretim alanlarına ilave yazlık ekiliş yapılabilecek alanlarda uygulama tohum bedelinin yüzde hibe yüzde İl Özel İdaresi katkısı teslimleri gerçekleştik,102
262,https://www.haberler.com/kutahya-da-ciftcilere-yaglik-aycicegi-ve-dane-13221545-haberi/,1,Ürünleri belirlerken birim alandan yüksek geliri dönem itibariyle hangi ürünlerden elde edebileceğimizi tespit ettikten sonra Bakanlığımızdan talepte bulunduk,18
263,https://www.haberler.com/kutahya-da-ciftcilere-yaglik-aycicegi-ve-dane-13221545-haberi/,2,Korona virüs Covit salgını dolayısıyla bitkisel üretimin devamlılığı gıda arz güvencesini sağlamanın önümüzdeki dönem büyük önem taşıdığı günlerde Bakanlığımızdan gelen ilave ödenek yağlık ayçiçeği dane mısır ekilişleri başlamıştır,28
264,https://www.haberler.com/kutahya-da-ciftcilere-yaglik-aycicegi-ve-dane-13221545-haberi/,3,İlimiz yüzde hibeli tohum dağıtılacak iller arasına girmesi yoğun gayret sarf eden Valimize Milletvekillerimize siyasi büyüklerimize çiftçilerimiz adına teşekkür ediyorum,20
265,https://www.haberler.com/kutahya-da-ciftcilere-yaglik-aycicegi-ve-dane-13221545-haberi/,4,Üreticilerimize hayırlı olsun konuştu,4
266,https://www.haberler.com/kutahya-da-ciftcilere-yaglik-aycicegi-ve-dane-13221545-haberi/,5,KÜTAHYAKaynak İHA,2
267,https://www.haberler.com/ferrari-vettel-in-yerine-carlos-sainz-i-getirdi-13221544-haberi/,0,Formula takımlarından Ferrari Alman pilot Sebastian Vettel yolların ayrılmasının ardından takıma İspanyol sürücü Carlos Sainz dahil ettiklerini resmen açıkladı Formula ekiplerinden Ferrari Alman pilot Sebastian Vettel in boşluğunu doldurdu,29
268,https://www.haberler.com/ferrari-vettel-in-yerine-carlos-sainz-i-getirdi-13221544-haberi/,1,Ferrari nin resmi internet sitesinden yapılan açıklamada İspanyol sürücü Carlos Sainz de başlamak üzere iki yıllık sözleşme imzalandığını duyuruldu yaşındaki pilot yılında itibaren Ferrari yarışacağı mutluluğu dile getirirken takımla geleceğiyle ilgili olarak heyecanlı olduğunu söyledi Ferrari Takım Müdürü Mattia Binotto konuyla ilgili olarak Carlos un sezonundan itibaren Ferrari ye katılacağını duyurmaktan mutluluk duyuyorum,53
269,https://www.haberler.com/ferrari-vettel-in-yerine-carlos-sainz-i-getirdi-13221544-haberi/,2,Zaten beş yıllık deneyime sahip olan Carlos yetenekli olduğunu kanıtladı dedi Carlos Sainz kariyerinde Toro Rosso Renault McLaren toplam yarıştı oldu Ferrari sezonunda Charles Leclerc Carlos Sainz ikilisi mücadele edecek,30
270,https://www.haberler.com/ferrari-vettel-in-yerine-carlos-sainz-i-getirdi-13221544-haberi/,3,İSTANBULKaynak İHA,2
271,https://www.haberler.com/nato-boru-hattindan-akaryakit-calan-supheli-13221543-haberi/,0,AFYONKARAHİSAR dan geçen NATO petrol boru hattına dışarıdan müdahale ederek kelepçe vana ekleyip akaryakıt çaldığı tespit edilen şüpheliden yakalandı,19
272,https://www.haberler.com/nato-boru-hattindan-akaryakit-calan-supheli-13221543-haberi/,1,Şüphelinin evinde yapılan aramalarda PKK KCK terör örgütünü simgeleyen bez parçaları ele geçirildi,13
273,https://www.haberler.com/nato-boru-hattindan-akaryakit-calan-supheli-13221543-haberi/,2,Olayla ilgili kişi aranıyor Sinanpaşa ilçesine bağlı Serban beldesinden geçen NATO petrol boru hattının petrol basıncında düşüş yaşanınca görevli personel jandarmaya bildirdi,22
274,https://www.haberler.com/nato-boru-hattindan-akaryakit-calan-supheli-13221543-haberi/,3,Sinanpaşa İlçe Jandarma Komutanlığı tarafından yapılan kontrollerde boru hattına kelepçe vana eklenerek akaryakıt çalındığı tespit edildi,16
275,https://www.haberler.com/nato-boru-hattindan-akaryakit-calan-supheli-13221543-haberi/,4,Afyonkarahisar İl Jandarma Komutanlığı na bağlı JASAT Sinanpaşa İlçe Jandarma Komutanlığı birlikte yürütülen ortak operasyonda akaryakıt çalmakta kullanılan kelepçe hortumlar üzerinde yapılan detaylı araştırmalar neticesinde malzemeleri üreten İstanbul daki firmaya ulaşıldı,31
276,https://www.haberler.com/nato-boru-hattindan-akaryakit-calan-supheli-13221543-haberi/,5,Firmanın hırsızlıkta kullanılan malzemeleri İzmir in Torbalı ilçesindeki bir toptancı firmasına sattığı belirlendi,13
277,https://www.haberler.com/nato-boru-hattindan-akaryakit-calan-supheli-13221543-haberi/,6,Torbalı daki firmayla iletişime geçen ekipler malzemelerin D,8
278,https://www.haberler.com/nato-boru-hattindan-akaryakit-calan-supheli-13221543-haberi/,7,tarafından satın alındığını tespit etti,5
279,https://www.haberler.com/nato-boru-hattindan-akaryakit-calan-supheli-13221543-haberi/,8,T,1
280,https://www.haberler.com/nato-boru-hattindan-akaryakit-calan-supheli-13221543-haberi/,9,nin üzerine kayıtlı kamyonetle Nisan tarihinde yanındaki kişiyle İzmir den Afyonkarahisar geldiği gün sonra kent merkezinden bölgeye giderek hırsızlık olayını gerçekleştirip ardından yeniden İzmir döndüğü saptandı JASAT ekipleri tarafından şüphelilerin kimlik adres tespiti yapıldı,34
281,https://www.haberler.com/nato-boru-hattindan-akaryakit-calan-supheli-13221543-haberi/,10,Mayıs günü İzmir de düzenlenen baskında şüphelilerden K,8
282,https://www.haberler.com/nato-boru-hattindan-akaryakit-calan-supheli-13221543-haberi/,11,yakalandı,1
283,https://www.haberler.com/nato-boru-hattindan-akaryakit-calan-supheli-13221543-haberi/,1,Şüphelinin evinde yapılan aramalarda PKK KCK terör örgütünü simgeleyen bez parçaları ele geçirildi,13
284,https://www.haberler.com/nato-boru-hattindan-akaryakit-calan-supheli-13221543-haberi/,13,B,1
285,https://www.haberler.com/nato-boru-hattindan-akaryakit-calan-supheli-13221543-haberi/,14,İzmir den Afyonkarahisar getirildi,4
286,https://www.haberler.com/nato-boru-hattindan-akaryakit-calan-supheli-13221543-haberi/,15,Olaya karışan D,3
287,https://www.haberler.com/nato-boru-hattindan-akaryakit-calan-supheli-13221543-haberi/,16,R isimli şüphelileri arama çalışmalarına devam edildiği belirtildi,8
288,https://www.haberler.com/nato-boru-hattindan-akaryakit-calan-supheli-13221543-haberi/,0,AFYONKARAHİSAR dan geçen NATO petrol boru hattına dışarıdan müdahale ederek kelepçe vana ekleyip akaryakıt çaldığı tespit edilen şüpheliden yakalandı,19
289,https://www.haberler.com/nato-boru-hattindan-akaryakit-calan-supheli-13221543-haberi/,1,Şüphelinin evinde yapılan aramalarda PKK KCK terör örgütünü simgeleyen bez parçaları ele geçirildi,13
290,https://www.haberler.com/nato-boru-hattindan-akaryakit-calan-supheli-13221543-haberi/,2,Olayla ilgili kişi aranıyor Sinanpaşa ilçesine bağlı Serban beldesinden geçen NATO petrol boru hattının petrol basıncında düşüş yaşanınca görevli personel jandarmaya bildirdi,22
291,https://www.haberler.com/nato-boru-hattindan-akaryakit-calan-supheli-13221543-haberi/,3,Sinanpaşa İlçe Jandarma Komutanlığı tarafından yapılan kontrollerde boru hattına kelepçe vana eklenerek akaryakıt çalındığı tespit edildi,16
292,https://www.haberler.com/nato-boru-hattindan-akaryakit-calan-supheli-13221543-haberi/,4,Afyonkarahisar İl Jandarma Komutanlığı na bağlı JASAT Sinanpaşa İlçe Jandarma Komutanlığı birlikte yürütülen ortak operasyonda akaryakıt çalmakta kullanılan kelepçe hortumlar üzerinde yapılan detaylı araştırmalar neticesinde malzemeleri üreten İstanbul daki firmaya ulaşıldı,31
293,https://www.haberler.com/nato-boru-hattindan-akaryakit-calan-supheli-13221543-haberi/,5,Firmanın hırsızlıkta kullanılan malzemeleri İzmir in Torbalı ilçesindeki bir toptancı firmasına sattığı belirlendi,13
294,https://www.haberler.com/nato-boru-hattindan-akaryakit-calan-supheli-13221543-haberi/,6,Torbalı daki firmayla iletişime geçen ekipler malzemelerin D,8
295,https://www.haberler.com/nato-boru-hattindan-akaryakit-calan-supheli-13221543-haberi/,7,tarafından satın alındığını tespit etti,5
296,https://www.haberler.com/nato-boru-hattindan-akaryakit-calan-supheli-13221543-haberi/,8,T,1
297,https://www.haberler.com/nato-boru-hattindan-akaryakit-calan-supheli-13221543-haberi/,9,nin üzerine kayıtlı kamyonetle Nisan tarihinde yanındaki kişiyle İzmir den Afyonkarahisar geldiği gün sonra kent merkezinden bölgeye giderek hırsızlık olayını gerçekleştirip ardından yeniden İzmir döndüğü saptandı JASAT ekipleri tarafından şüphelilerin kimlik adres tespiti yapıldı,34
298,https://www.haberler.com/nato-boru-hattindan-akaryakit-calan-supheli-13221543-haberi/,10,Mayıs günü İzmir de düzenlenen baskında şüphelilerden K,8
299,https://www.haberler.com/nato-boru-hattindan-akaryakit-calan-supheli-13221543-haberi/,11,yakalandı,1
300,https://www.haberler.com/nato-boru-hattindan-akaryakit-calan-supheli-13221543-haberi/,1,Şüphelinin evinde yapılan aramalarda PKK KCK terör örgütünü simgeleyen bez parçaları ele geçirildi,13
301,https://www.haberler.com/nato-boru-hattindan-akaryakit-calan-supheli-13221543-haberi/,13,B,1
302,https://www.haberler.com/nato-boru-hattindan-akaryakit-calan-supheli-13221543-haberi/,14,İzmir den Afyonkarahisar getirildi,4
303,https://www.haberler.com/nato-boru-hattindan-akaryakit-calan-supheli-13221543-haberi/,15,Olaya karışan D,3
304,https://www.haberler.com/nato-boru-hattindan-akaryakit-calan-supheli-13221543-haberi/,16,R isimli şüphelileri arama çalışmalarına devam edildiği belirtildi,8
305,https://www.haberler.com/nato-boru-hattindan-akaryakit-calan-supheli-13221543-haberi/,34,Sinanpaşa ilçesine bağlı Serban beldesinden geçen NATO petrol boru hattının petrol basıncında düşüş yaşanınca görevli personel jandarmaya bildirdi,18
306,https://www.haberler.com/nato-boru-hattindan-akaryakit-calan-supheli-13221543-haberi/,3,Sinanpaşa İlçe Jandarma Komutanlığı tarafından yapılan kontrollerde boru hattına kelepçe vana eklenerek akaryakıt çalındığı tespit edildi,16
307,https://www.haberler.com/nato-boru-hattindan-akaryakit-calan-supheli-13221543-haberi/,36,Afyonkarahisar İl Jandarma Komutanlığı na bağlı JASAT Sinanpaşa İlçe Jandarma Komutanlığı birlikte yürütülen ortak operasyonda akaryakıt çalmakta kullanılan kelepçe hortumlar üzerinde yapılan detaylı araştırmalar neticesinde malzemeleri üreten İstanbul daki firmaya ulaşıldı JASAT ekipleri tarafından şüphelilerin kimlik adres tespiti yapıldı,39
308,https://www.haberler.com/nato-boru-hattindan-akaryakit-calan-supheli-13221543-haberi/,10,Mayıs günü İzmir de düzenlenen baskında şüphelilerden K,8
309,https://www.haberler.com/nato-boru-hattindan-akaryakit-calan-supheli-13221543-haberi/,11,yakalandı,1
310,https://www.haberler.com/nato-boru-hattindan-akaryakit-calan-supheli-13221543-haberi/,1,Şüphelinin evinde yapılan aramalarda PKK KCK terör örgütünü simgeleyen bez parçaları ele geçirildi,13
311,https://www.haberler.com/nato-boru-hattindan-akaryakit-calan-supheli-13221543-haberi/,13,B,1
312,https://www.haberler.com/nato-boru-hattindan-akaryakit-calan-supheli-13221543-haberi/,14,İzmir den Afyonkarahisar getirildi,4
313,https://www.haberler.com/nato-boru-hattindan-akaryakit-calan-supheli-13221543-haberi/,15,Olaya karışan D,3
314,https://www.haberler.com/nato-boru-hattindan-akaryakit-calan-supheli-13221543-haberi/,43,R isimli şüphelileri arama çalışmalarına devam edildiği belirtildi Kaynak DHA,10
315,https://www.haberler.com/vali-su-dan-hemsirelere-pandemi-tesekkuru-13221542-haberi/,0,MERSİN İHA Mersin Valisi Ali İhsan Su Hemşireler Günü dolayısıyla telekonferansla bir araya geldiği hemşirelere salgınla mücadelede ön saflarda yoğun gayret gösterdikleri teşekkür ederek Aldığımız tedbirlerle büyükşehirler içinde vaka ölüm oranına sahibiz,32
316,https://www.haberler.com/vali-su-dan-hemsirelere-pandemi-tesekkuru-13221542-haberi/,1,Aynı birlik beraberlik yaklaşımla süreci birlikte sonuçlandıracağız,7
317,https://www.haberler.com/vali-su-dan-hemsirelere-pandemi-tesekkuru-13221542-haberi/,2,İnşallah kısa sürede virüsü ilimizde bitirmiş olacağız dedi Vali Su Mayıs Hemşireler Günü Mayıs Hemşireler Haftası kapsamında İl Sağlık Müdürü Sinan Bahçacı Mersin de hizmet veren yataklı sağlık tesislerinde çalışan hemşirelerle telekonferans görüşmesinde bir araya geldi,36
318,https://www.haberler.com/vali-su-dan-hemsirelere-pandemi-tesekkuru-13221542-haberi/,3,Mayıs Hemşireler Günü dolayısıyla sağlık sektörünün pandemi sürecinin kahramanları olan hemşirelerin gününü kutlamak amacıyla yapılan telekonferans görüşmesinde hemşirelere hitap eden Vali Su Korona virüs mücadele sürecini birlikte yürütmeye devam ediyoruz,30
319,https://www.haberler.com/vali-su-dan-hemsirelere-pandemi-tesekkuru-13221542-haberi/,4,Bu mücadelede hemşirelerin emeği fazla,5
320,https://www.haberler.com/vali-su-dan-hemsirelere-pandemi-tesekkuru-13221542-haberi/,5,Salgın mücadelenin ön saflarında yer alıp gecesini gündüzüne katarak milletimizin ülkemizin salgını hasarla atlatması yoğun gayret gösteren hemşirelerimizin nezdinde sağlık çalışanlarımıza şükranlarımı sunuyorum konuştu,24
