,url,segment_no,cumle_icerigi,kelime_sayısı
758,https://www.haberler.com/baskan-ozcan-ciftcilerin-gununu-kutladi-13221498-haberi/,0,Nazilli Belediye Başkanı Kürşat Engin Özcan Mayıs Dünya Çiftçiler Günü nü kutladı başkan Özcan çiftçilerin emek yoğun bir şekilde toprağı işleyerek insanoğlunun yaşam kalitesini artıran yaşam süresini uzatan büyük bir sorumluluğun altında olduklarını söyledi Özcan Toprağı işleyen çiftçilerimizin üretimin sürekliliğinin daim olduğu tarımın ülkemizde büyük ekonomik sosyal stratejik bir önemi değeri var,52
759,https://www.haberler.com/baskan-ozcan-ciftcilerin-gununu-kutladi-13221498-haberi/,1,Kalkınmanın yolunun tarımdan geçtiği ülkemizde çiftçimizi güçlendirmek yerel yönetimler olarak bizlerin asli görevi,13
760,https://www.haberler.com/baskan-ozcan-ciftcilerin-gununu-kutladi-13221498-haberi/,2,Bu nedenle Naz Koop kurarak birbiriyle bağıntılı tarım çiftçi kooperatiflerimizi besleyecek güçlendirecek bir atılımı gerçekleştirmek istiyoruz dedi Uluslararası Tarım Üreticileri Federasyonu tarafından yılında alınan bir kararla kutlanan Mayıs Dünya Çiftçiler Günü nü kutlayan Özcan çiftçilerin baharın yaza dönüştüğü toprağın ekinlerle bezenip bütün cömertliğini göstermeye başladığı günlerde bol bereketli bir hasat yılı geçirmelerini dilediğini ifade etti,55
761,https://www.haberler.com/baskan-ozcan-ciftcilerin-gununu-kutladi-13221498-haberi/,3,AYDINKaynak İHA,2
762,https://www.haberler.com/bursa-bag-evindeki-cinayetin-katil-zanlisini-13221497-haberi/,0,Bağ evindeki cinayetin katil zanlısını güvenlik kamerasındaki panik hali yakalatmışBURSA da bağ evinde Güven Akyıl bıçaklayarak öldüren cinayetten saat sonra yakalanan B,22
763,https://www.haberler.com/bursa-bag-evindeki-cinayetin-katil-zanlisini-13221497-haberi/,1,yi güvenlik kamerasına yansıyan görüntülerindeki panik halinin ele verdiği ortaya çıktı Olay geçen cuma günü İnegöl ilçesindeki Deydinler Maden Mahalleleri arasında bulunan bağ evinde yaşandı,25
764,https://www.haberler.com/bursa-bag-evindeki-cinayetin-katil-zanlisini-13221497-haberi/,2,Babası Güven Akyıl dan uzun süre haber alamayan kızı saat sıralarında bağ evine geldi,14
765,https://www.haberler.com/bursa-bag-evindeki-cinayetin-katil-zanlisini-13221497-haberi/,3,Bıçaklanarak öldürülen babasının köpekler tarafından parçalanmış cesedini bulan genç kadın jandarma sağlık ekiplerini aradı,14
766,https://www.haberler.com/bursa-bag-evindeki-cinayetin-katil-zanlisini-13221497-haberi/,4,İhbar üzerine gelen ekipler Akyıl ın cesedi bulunduktan yaklaşık saat önce öldürüldüğünü köpekler tarafından parçalandığını belirledi SAAT GEÇMEDEN YAKALANDIKati zanlısını belirlemek geniş çaplı araştırma başlatan jandarma ekipleri çevredeki güvenlik kameralarının görüntülerini mercek altına aldı,34
767,https://www.haberler.com/bursa-bag-evindeki-cinayetin-katil-zanlisini-13221497-haberi/,5,Görüntülerde bir kişinin panik halinde hızlıca yürüdüğü görüldü,8
768,https://www.haberler.com/bursa-bag-evindeki-cinayetin-katil-zanlisini-13221497-haberi/,6,Şüphelerin yoğunlaştığı kişinin B,4
769,https://www.haberler.com/bursa-bag-evindeki-cinayetin-katil-zanlisini-13221497-haberi/,7,olduğu tespit edildi,3
770,https://www.haberler.com/bursa-bag-evindeki-cinayetin-katil-zanlisini-13221497-haberi/,8,Jandarma ekipleri şüpheliyi cinayetten saat sonra saklandığı evde yakaladı CEZAEVİNE GÖNDERİLDİGözaltına alınan B,13
771,https://www.haberler.com/bursa-bag-evindeki-cinayetin-katil-zanlisini-13221497-haberi/,9,jandarmadaki ifadesinde Güven Akyıl aramızda tartışma çıktı,7
772,https://www.haberler.com/bursa-bag-evindeki-cinayetin-katil-zanlisini-13221497-haberi/,10,Tartışmanın büyümesi üzerine mutfaktan aldığım bıçakla Güven Akyıl bıçaklayarak evden kaçtım,11
773,https://www.haberler.com/bursa-bag-evindeki-cinayetin-katil-zanlisini-13221497-haberi/,11,Öldüğünü sonradan öğrendim dedi Sorgusunun ardından adliyeye sevk edilen B,10
774,https://www.haberler.com/bursa-bag-evindeki-cinayetin-katil-zanlisini-13221497-haberi/,12,nöbetçi mahkemece tutuklanarak cezaevine gönderildi Kaynak DHA,7
775,https://www.haberler.com/genclerbirligi-nden-besiktas-a-gecmis-olsun-mesaji-13221496-haberi/,0,Gençlerbirliği Kulübü kişinin yeni tip koronavirüs Kovid testinin pozitif çıktığını açıklayan Beşiktaş geçmiş olsun mesajı yayımladı Başkent kulübünün sosyal medya hesabından yapılan paylaşımda Beşiktaş camiasına geçmiş olsun dileklerimizi iletiyor testi pozitif çıkan kişinin kısa sürede sağlığına kavuşmasını temenni ediyoruz,39
776,https://www.haberler.com/genclerbirligi-nden-besiktas-a-gecmis-olsun-mesaji-13221496-haberi/,1,denildi Kaynak AA,3
777,https://www.haberler.com/nevsehir-belediye-meclisi-yarin-olaganustu-13221495-haberi/,0,Nevşehir Belediye Meclisi yoğun bir gündem uzun bir aradan sonra Mayıs Cuma günü olağanüstü toplanacak,15
778,https://www.haberler.com/nevsehir-belediye-meclisi-yarin-olaganustu-13221495-haberi/,1,Toplantının yapılacağı Kapadokya Kültür Sanat Merkezi nde yeni tip korona virüs Kovid tedbirleri kapsamında dezenfekte çalışması gerçekleştirildi Korona virüs salgını dolayısıyla son toplantısını Mart tarihinde gerçekleştirilen Nevşehir Belediye Meclisi olağanüstü gündem toplanacak,32
779,https://www.haberler.com/nevsehir-belediye-meclisi-yarin-olaganustu-13221495-haberi/,2,Mayıs Cuma günü AK Parti MHP İyi Partili meclis üyelerinin katılımı Kapadokya Kültür Sanat Merkezi nde gerçekleştirilecek olan toplantı saat de başlayacak,22
780,https://www.haberler.com/nevsehir-belediye-meclisi-yarin-olaganustu-13221495-haberi/,3,Meclis üyeleri arasından encümen üyeleri seçimi meclis komisyonlarına üye seçimi başlayacak olan toplantıda sonra yılı kesin hesabı yılı faaliyet raporu görüşülecek,21
781,https://www.haberler.com/nevsehir-belediye-meclisi-yarin-olaganustu-13221495-haberi/,4,Denetim Komisyonu İmar Komisyonu raporları İmar tadilatı taleplerinin görüşülmesi sürecek olan toplantıda Çevre Şehircilik Bakanlığından hibe çöp kamyonları alınması Kredinin Revize Edilmesi Kredi Kullanılması Teminat Mektubu Alınması İşçi Kadro İhdas Cetvelleri Memur Kadro İhdas Cetvelleri Kira alacaklarının ertelenmesi Toplu taşıma hat ücretlerinin ertelenmesi Okul servis araçları yönetmeliğinin,47
782,https://www.haberler.com/nevsehir-belediye-meclisi-yarin-olaganustu-13221495-haberi/,5,Maddesi Taksi yıllık vize başvuru süresinin uzatılması Belediye hizmetlerinde kullanılmak üzere bir adet traktör hibesinin görüşülmesi ikinci el araçların belediye envanterine alınması konuları ele alınacak,25
783,https://www.haberler.com/nevsehir-belediye-meclisi-yarin-olaganustu-13221495-haberi/,6,Korona virüs tedbirleri nedeniyle sosyal mesafenin korunabilmesi amacıyla Kapadokya Kültür Sanat Merkezi nde gerçekleştirilmesi kararlaştırılan toplantı öncesinde merkezde dezenfekte çalışması gerçekleştirildi Temizlik İşleri Müdürlüğüne bağlı ekiplerce gerçekleştirilen çalışma birlikte toplantının yapılacağı salon fuaye salonu bekleme bölümleri titizlikle temizlenerek dezenfekte edildi,40
784,https://www.haberler.com/nevsehir-belediye-meclisi-yarin-olaganustu-13221495-haberi/,7,NEVŞEHİRKaynak İHA,2
785,https://www.haberler.com/karsiyaka-nin-kafasi-karisti-13221494-haberi/,0,KORONAVİRÜS salgınıyla yaklaşık aydır duran alt liglerin başlangıç tarihinin Futbol Federasyonu tarafından dün tekrar değiştirilmesi kulüp TFF,17
786,https://www.haberler.com/karsiyaka-nin-kafasi-karisti-13221494-haberi/,1,Lig,1
787,https://www.haberler.com/karsiyaka-nin-kafasi-karisti-13221494-haberi/,2,Grup taki Karşıyaka nın aklını karıştırdı,6
788,https://www.haberler.com/karsiyaka-nin-kafasi-karisti-13221494-haberi/,3,Liglerin önce Haziran hafta sonu tekrar start alacağının açıklanmasıyla antrenmanlara dezenfekte edilip TFF Sağlık Kurulu nun Futbola Dönüş Protokolü uygulanan tesislerde kamp yapıp sosyal mesafeyi koruyarak hafta önce başlayan Kaf Kaf testten geçirilen kulüplerde koronavirüs vakalarına rastlanınca topla taktik çalışmaları erteledi,41
789,https://www.haberler.com/karsiyaka-nin-kafasi-karisti-13221494-haberi/,4,Bugün test yaptırıp ardından takım antrenmanlarına başlamayı hedefleyen yeşil kırmızılılar TFF dün akşam,13
790,https://www.haberler.com/karsiyaka-nin-kafasi-karisti-13221494-haberi/,1,Lig,1
791,https://www.haberler.com/karsiyaka-nin-kafasi-karisti-13221494-haberi/,6,Lig Bölgesel Amatör Lig in yeniden başlangıç tarihini şimdilik Temmuz çekince bütün çalışmalarını durdurdu,14
792,https://www.haberler.com/karsiyaka-nin-kafasi-karisti-13221494-haberi/,7,Takıma tekrar izin veren Karşıyaka nın tarih yeniden değişmezse Haziran da tekrar toplanması bekleniyor,14
793,https://www.haberler.com/karsiyaka-nin-kafasi-karisti-13221494-haberi/,8,Mart ta ara verilen sezonun Temmuz kadar ay ara verecek olması ligin yaz sıcaklarına denk gelip,16
794,https://www.haberler.com/karsiyaka-nin-kafasi-karisti-13221494-haberi/,9,Lig deki birçok kulübün ışıklandırmasız statları bulunması takımların çoğunun sezonun sonlandırılmasını istemesi lig ağustosa sarkarsa transfer döneminde yaşanacak belirsizlikler etmenlerle alt liglerin devam edip etmeyeceği merak konusu,27
795,https://www.haberler.com/karsiyaka-nin-kafasi-karisti-13221494-haberi/,10,OLAN KAPTANA OLDUKarşıyaka da ligler durdurulduktan sonra ailesiyle birlikte memleketi Diyarbakır gidip ikinci baba olan takım kaptanı Mustafa Aşan Futbol Federasyonu nun tarih değişikliği kararını antrenmanlar geri dönüş yolunda aldı,30
796,https://www.haberler.com/karsiyaka-nin-kafasi-karisti-13221494-haberi/,11,Diyarbakır dan kilometre yolu saatte karayoluyla gelen Mustafa kararı öğrense geri dönmeyip bir süre İzmir de kalmayı seçti,18
797,https://www.haberler.com/karsiyaka-nin-kafasi-karisti-13221494-haberi/,0,KORONAVİRÜS salgınıyla yaklaşık aydır duran alt liglerin başlangıç tarihinin Futbol Federasyonu tarafından dün tekrar değiştirilmesi kulüp TFF,17
798,https://www.haberler.com/karsiyaka-nin-kafasi-karisti-13221494-haberi/,1,Lig,1
799,https://www.haberler.com/karsiyaka-nin-kafasi-karisti-13221494-haberi/,2,Grup taki Karşıyaka nın aklını karıştırdı,6
800,https://www.haberler.com/karsiyaka-nin-kafasi-karisti-13221494-haberi/,3,Liglerin önce Haziran hafta sonu tekrar start alacağının açıklanmasıyla antrenmanlara dezenfekte edilip TFF Sağlık Kurulu nun Futbola Dönüş Protokolü uygulanan tesislerde kamp yapıp sosyal mesafeyi koruyarak hafta önce başlayan Kaf Kaf testten geçirilen kulüplerde koronavirüs vakalarına rastlanınca topla taktik çalışmaları erteledi,41
801,https://www.haberler.com/karsiyaka-nin-kafasi-karisti-13221494-haberi/,4,Bugün test yaptırıp ardından takım antrenmanlarına başlamayı hedefleyen yeşil kırmızılılar TFF dün akşam,13
802,https://www.haberler.com/karsiyaka-nin-kafasi-karisti-13221494-haberi/,1,Lig,1
803,https://www.haberler.com/karsiyaka-nin-kafasi-karisti-13221494-haberi/,6,Lig Bölgesel Amatör Lig in yeniden başlangıç tarihini şimdilik Temmuz çekince bütün çalışmalarını durdurdu,14
804,https://www.haberler.com/karsiyaka-nin-kafasi-karisti-13221494-haberi/,7,Takıma tekrar izin veren Karşıyaka nın tarih yeniden değişmezse Haziran da tekrar toplanması bekleniyor,14
805,https://www.haberler.com/karsiyaka-nin-kafasi-karisti-13221494-haberi/,8,Mart ta ara verilen sezonun Temmuz kadar ay ara verecek olması ligin yaz sıcaklarına denk gelip,16
806,https://www.haberler.com/karsiyaka-nin-kafasi-karisti-13221494-haberi/,9,Lig deki birçok kulübün ışıklandırmasız statları bulunması takımların çoğunun sezonun sonlandırılmasını istemesi lig ağustosa sarkarsa transfer döneminde yaşanacak belirsizlikler etmenlerle alt liglerin devam edip etmeyeceği merak konusu,27
807,https://www.haberler.com/karsiyaka-nin-kafasi-karisti-13221494-haberi/,10,OLAN KAPTANA OLDUKarşıyaka da ligler durdurulduktan sonra ailesiyle birlikte memleketi Diyarbakır gidip ikinci baba olan takım kaptanı Mustafa Aşan Futbol Federasyonu nun tarih değişikliği kararını antrenmanlar geri dönüş yolunda aldı,30
808,https://www.haberler.com/karsiyaka-nin-kafasi-karisti-13221494-haberi/,11,Diyarbakır dan kilometre yolu saatte karayoluyla gelen Mustafa kararı öğrense geri dönmeyip bir süre İzmir de kalmayı seçti,18
809,https://www.haberler.com/karsiyaka-nin-kafasi-karisti-13221494-haberi/,4,Bugün test yaptırıp ardından takım antrenmanlarına başlamayı hedefleyen yeşil kırmızılılar TFF dün akşam,13
810,https://www.haberler.com/karsiyaka-nin-kafasi-karisti-13221494-haberi/,1,Lig,1
811,https://www.haberler.com/karsiyaka-nin-kafasi-karisti-13221494-haberi/,6,Lig Bölgesel Amatör Lig in yeniden başlangıç tarihini şimdilik Temmuz çekince bütün çalışmalarını durdurdu,14
812,https://www.haberler.com/karsiyaka-nin-kafasi-karisti-13221494-haberi/,7,Takıma tekrar izin veren Karşıyaka nın tarih yeniden değişmezse Haziran da tekrar toplanması bekleniyor,14
813,https://www.haberler.com/karsiyaka-nin-kafasi-karisti-13221494-haberi/,8,Mart ta ara verilen sezonun Temmuz kadar ay ara verecek olması ligin yaz sıcaklarına denk gelip,16
814,https://www.haberler.com/karsiyaka-nin-kafasi-karisti-13221494-haberi/,29,Lig deki birçok kulübün ışıklandırmasız statları bulunması takımların çoğunun sezonun sonlandırılmasını istemesi lig ağustosa sarkarsa transfer döneminde yaşanacak belirsizlikler etmenlerle alt liglerin devam edip etmeyeceği merak konusu Karşıyaka da ligler durdurulduktan sonra ailesiyle birlikte memleketi Diyarbakır gidip ikinci baba olan takım kaptanı Mustafa Aşan Futbol Federasyonu nun tarih değişikliği kararını antrenmanlar geri dönüş yolunda aldı,55
815,https://www.haberler.com/karsiyaka-nin-kafasi-karisti-13221494-haberi/,30,Diyarbakır dan kilometre yolu saatte karayoluyla gelen Mustafa kararı öğrense geri dönmeyip bir süre İzmir de kalmayı seçti Kaynak DHA,20
816,https://www.haberler.com/basiskele-belediyesi-nden-odullu-online-satranc-13221493-haberi/,0,Başiskele Belediyesi Mayıs Atatürk Anma Gençlik Spor Bayramı na özel ödüllü online satranç turnuvası düzenliyor Başiskele Belediyesi Gençlik Spor Hizmetleri Müdürlüğü tarafından organize edilen Mayıs Atatürk Anma Gençlik Spor Bayramı Ödüllü Online Satranç Turnuvası korona virüs tedbirleri kapsamında evde kalan Başiskeleli gençlerin sosyalleşmesini sağlayacak,44
817,https://www.haberler.com/basiskele-belediyesi-nden-odullu-online-satranc-13221493-haberi/,1,İnternet üzerinden Mayıs Pazartesi günü saat de başlayacak turnuva yaş altı yaş altı yaş altı olmak üzere üç kategoride düzenlenecek Ödüllü Online Satranç Turnuvası na katılım gösteren sporcular turnuva online davet linki turnuva başlangıç saatinden saat önce ilgili WhatsApp grubundan Chess com kulüp sayfasında paylaşılacak,45
818,https://www.haberler.com/basiskele-belediyesi-nden-odullu-online-satranc-13221493-haberi/,2,Turnuvada İsviçre sistemi kullanılacak olup tur sayısı sporcu sayısına göre belirlenecek,11
819,https://www.haberler.com/basiskele-belediyesi-nden-odullu-online-satranc-13221493-haberi/,3,Maçlar dakika saniye eklemeli tempoda oynanacak,6
820,https://www.haberler.com/basiskele-belediyesi-nden-odullu-online-satranc-13221493-haberi/,4,Kategorideki maçlar tamamlandıktan sonra sistem eşlendirmeyi otomatik olarak yaparak bir sonraki turu başlatacak,13
821,https://www.haberler.com/basiskele-belediyesi-nden-odullu-online-satranc-13221493-haberi/,5,Maçlar kategoride yöneticiler tarafından izlenecek Her kategoride ilk üç dereceyi elde eden sporculara Başiskele Belediyesi tarafından madalya sürpriz hediyeler verilecek,20
822,https://www.haberler.com/basiskele-belediyesi-nden-odullu-online-satranc-13221493-haberi/,6,Turnuva ilgili açıklamalarda bulunan Başiskele Belediye Başkanı Yasin Özlü salgın sürecini atlatınca turnuvaların yüz yüze yapılacağını vurgulayarak Mayıs Atatürk Anma Gençlik Spor Bayramı dolayısıyla Mayıs Pazartesi günü yapacağımız satranç turnuvamıza sporsever genç kardeşlerimizi bekliyorum,34
823,https://www.haberler.com/basiskele-belediyesi-nden-odullu-online-satranc-13221493-haberi/,7,Katılım sağlayan herkese başarılar diliyorum dedi,6
824,https://www.haberler.com/basiskele-belediyesi-nden-odullu-online-satranc-13221493-haberi/,8,KOCAELİKaynak İHA,2
825,https://www.haberler.com/kilis-valiliginden-kovid-19-uyarisi-aciklamasi-13221492-haberi/,0,Kilis Valiliği yeni tip koronavirüs Kovid vakalarının önemli kısmının yemek davetleri akraba komşulara yapılan ev ziyaretleri nedeniyle meydana geldiğini belirterek herkesi tedbirlere uymaya davet etti Valilik ten yapılan yazılı açıklamada Kovid salgınıyla mücadelede herkesin duyarlı olması gerektiği vurgulandı Vakalarla ilgili tespitlerin aktarıldığı açıklamada şunlar kaydedildi Koronavirüs yakınımızdaki akrabamız arkadaşımız komşularımızdan bulaşıyor,51
826,https://www.haberler.com/kilis-valiliginden-kovid-19-uyarisi-aciklamasi-13221492-haberi/,1,Vakaların önemli kısmının yemek davetleri akraba komşulara yapılan ev ziyaretleri kalabalık yerlerde bulunma maskesiz dışarı çıkmaktan kaynaklandığı müşahede edilmektedir,19
827,https://www.haberler.com/kilis-valiliginden-kovid-19-uyarisi-aciklamasi-13221492-haberi/,2,Bunların yanı sıra geniş katılımlı cenaze definleri taziye hasta ziyaretleri hastalığın bulaştığı durumların başında gelmektedir,15
828,https://www.haberler.com/kilis-valiliginden-kovid-19-uyarisi-aciklamasi-13221492-haberi/,3,Lütfen anılan durumlardan uzak duralım,5
829,https://www.haberler.com/kilis-valiliginden-kovid-19-uyarisi-aciklamasi-13221492-haberi/,4,Sosyal mesafemizi sevdiklerimizin bizlerin iyiliği tavizsiz koruyalım,7
830,https://www.haberler.com/kilis-valiliginden-kovid-19-uyarisi-aciklamasi-13221492-haberi/,5,Bu süreci el birliğiyle alacağımız tedbirlerle atlatacağız,7
831,https://www.haberler.com/kilis-valiliginden-kovid-19-uyarisi-aciklamasi-13221492-haberi/,6,Normalleşme zorunlu olmadıkça dışarı çıkılmaması gerektiği hatırlatılan açıklamada maske sosyal mesafe kuralından taviz verilmemesi gerektiği vurgulandı Kalabalıktan uzak durulmasının istendiği açıklamada Kişisel hijyenimize dikkat edelim eş dost akraba komşu ziyaretlerini erteleyelim taziye hasta ziyaretlerini erteleyelim evimiz dışında kapalı mekanlardan uzak duralım bireysel tedbirlerimizi üst seviyede tutalım lütfen evimizde kalalım,49
832,https://www.haberler.com/kilis-valiliginden-kovid-19-uyarisi-aciklamasi-13221492-haberi/,7,ifadelerine yer verildi Kaynak AA,5
833,https://www.haberler.com/pged-den-14-mayis-eczacilik-gunu-mesaji-13221491-haberi/,0,Pharmetic Girişimci Eczacılar Derneği PGED Yönetim Kurulu Başkanı Armağan Ener bilimsel eczacılığın yılına ulaşmasının anlamlı gururunu yaşadığını belirterek Nice Mayıs ları sağlık mutluluk içinde kutlamayı diliyorum,26
834,https://www.haberler.com/pged-den-14-mayis-eczacilik-gunu-mesaji-13221491-haberi/,1,ifadesini kullandı Ener Mayıs Eczacılık Günü dolayısıyla yaptığı yazılı açıklamada gelişen büyüyen yaşanılmadığı kadar hızla yenilenen öngörülemeyecek boyutta bir dijital dünyaya doğru yol alındığı düşünülürken dünyanın yerinde insanlar arasında sadece mal düşünce bilginin değil salgın hastalıklara olan mikrop virüslerin aynı hatta büyük bir hızla dolaşabileceğinin bunun sonuçlarının ağır olabileceğinin görüldüğünü belirtti Düşünülenin yaşanılanın tersine iletişim etkileşimi azaltmaya izole olmaya sosyal mesafeyi korumaya dönük bir çaba içine girildiğine işaret eden Ener tarihin bir Her işin başı sağlık atasözünü doğrularcasına kendilerine insanlık adına bir görev yüklediğini aktardı Armağan Ener şunları kaydetti Bizler tarihsel değerlerimizle ettiğimiz yemine etik meslek anlayışımıza bağlı basamak sağlık hizmet sunucuları olarak sağlık alanında görev alan bir kurum kuruluş bireyle omuz omuza dünya toplumunu ailemiz kabul ederek çalışmaya sağlık hizmetimizi durum şartta sürdürmeye devam ediyoruz,126
835,https://www.haberler.com/pged-den-14-mayis-eczacilik-gunu-mesaji-13221491-haberi/,2,Bu anlamda başta görevleri başında türlü riski alarak canını ortaya koyan salgın hastalıklara yakalanarak hayatlarını kaybeden sağlık çalışanlarımızı insanlarımızı saygıyla rahmetle anıyorum Bizler Galenos tan El Biruni den bugüne mesleğimize emek vermiş meslektaşlarımızın gücünü enerjisini yanımızda duygularını yüreğimizde verdikleri mücadelelerin sorumluluklarını omuzlarımızda hissediyoruz,43
836,https://www.haberler.com/pged-den-14-mayis-eczacilik-gunu-mesaji-13221491-haberi/,3,Bugünden itibaren değişen koşullardaki yaşam anlayışı farklı olacak,8
837,https://www.haberler.com/pged-den-14-mayis-eczacilik-gunu-mesaji-13221491-haberi/,4,Psikolojik sosyal ekonomik yönde yaşanacak farklılıklara önce kendimizi adapte edeceğiz sonra sorumlu olduğumuz topluma yardımcı olmaya çalışacağız,17
838,https://www.haberler.com/pged-den-14-mayis-eczacilik-gunu-mesaji-13221491-haberi/,5,Bu anlamda birliğimizi beraberliğimizi güçlendireceğiz,5
839,https://www.haberler.com/pged-den-14-mayis-eczacilik-gunu-mesaji-13221491-haberi/,6,Bilimsel eczacılığın yılına ulaşmasının anlamlı gururunu yaşarken nice Mayıs ları sağlık mutluluk içinde kutlamayı diliyorum,15
840,https://www.haberler.com/pged-den-14-mayis-eczacilik-gunu-mesaji-13221491-haberi/,7,Öte yandan dernek Mayıs Eczacılık günü dolayısıyla hazırladığı videoda gece gündüz görevimizin başındayız,13
841,https://www.haberler.com/pged-den-14-mayis-eczacilik-gunu-mesaji-13221491-haberi/,8,mesajını paylaştı Kaynak AA,4
842,https://www.haberler.com/kahramanmaras-ta-aydinlatma-diregine-carpan-13221490-haberi/,0,Kahramanmaraş ta aydınlatma direğine çarpan otomobildeki kişi yaralandı Abdülkadir idaresindeki VEM plakalı otomobil Şazibey Mahallesi Batı Çevre Yolunda seyir halindeyken sürücüsünün direksiyon hakimiyetini kaybetmesi sonucu aydınlatma direğine çarptı Kazada sürücüyle birlikte araçtaki Merve Emre yaralandı Acil Servis ekiplerince Kahramanmaraş Sütçü İmam Üniversitesi Sağlık Uygulama Araştırma Hastanesine kaldırılan yaralıların sağlık durumlarının iyi olduğu öğrenildi Kaynak AA,55
843,https://www.haberler.com/atakum-dan-600-ureticiye-21-bin-fide-destegi-13221489-haberi/,0,Atakum dan üreticiye bin fide desteğiSAMSUN Atakum Belediyesi ilçe genelinde tarımsal üretimin yaygınlaşması amacıyla projelerine hızıyla devam ediyor,18
844,https://www.haberler.com/atakum-dan-600-ureticiye-21-bin-fide-destegi-13221489-haberi/,1,Belediye ekipleri Atakum un kırsal mahallelerinde geçimini çiftçilikle sağlayan vatandaşlar ücretsiz olarak domates biber patlıcan fidesi ulaştırdı,17
845,https://www.haberler.com/atakum-dan-600-ureticiye-21-bin-fide-destegi-13221489-haberi/,2,Çalışma kapsamında üreticiye bin fide dağıtıldı,6
846,https://www.haberler.com/atakum-dan-600-ureticiye-21-bin-fide-destegi-13221489-haberi/,3,Atakum Belediyesi ilçede tarım faaliyetleriyle geçimini sağlayan çiftçilerin fazla üretim yapabilmesi tarımsal üretimin kırsal mahallelerin geneline yaygınlaştırılması özverili çalışmalarına devam ediyor,21
847,https://www.haberler.com/atakum-dan-600-ureticiye-21-bin-fide-destegi-13221489-haberi/,4,Daha önce yüksek kaliteli tohumları kendi arazilerinde dikip çiftçilere ulaştırmak kolları sıvayan Kırsal Hizmetler Müdürlüğü ekipleri çiftçiye bin fidan tohumu dağıttı,21
848,https://www.haberler.com/atakum-dan-600-ureticiye-21-bin-fide-destegi-13221489-haberi/,5,Fideleri üreticilerle birlikte toprakla buluşturan Atakum Belediyesi ekipleri kentin tarım yapılan mahallesinde çiftçiyle buluştu bin fide çiftçiye ulaştıAtakum da nüfusun büyük çoğunluğunun tarımla geçimini sağladığı kırsal mahallesi olan Alanlı Akalan Aksu Aslandamı Ayvalı Büyükkolpınar Beypınarı Çakırlar Çobanözü Çobanlı Çamlıyazı Elmaçukuru Erikli Güney Kabadüz Kamalı Kesilli Karaoyumca Karakavuk Kasnakçımermer Kulacadağ Meyvalı Sarıtaş Kayagüney Köseli Çatmaoluk Mahallelerinde muhtarlar aracılığıyla fide taleplerini değerlendiren ekipler temin edilen bin adet domates biber patlıcan fidesini üreticiye ulaştırdı,71
849,https://www.haberler.com/atakum-dan-600-ureticiye-21-bin-fide-destegi-13221489-haberi/,6,Aynı zamanda Atakum Belediyesi nin Ziraat Mühendisleri sık sık ziyaret ettiği mahallelerde fideleri dağıtırken tarımla ilgili bilimsel verileri üreticilerle paylaşarak sorularını cevapladı,22
850,https://www.haberler.com/atakum-dan-600-ureticiye-21-bin-fide-destegi-13221489-haberi/,7,Çiftçiler belediyenin desteklerinin kendileri önemli olduğunu belirterek ekiplere teşekkür etti Toprağın önemini anladıkKırsal mahallelerde herkesin dikim yapabilmeleri fide taleplerini karşıladıklarını belirten Atakum Belediyesi Kırsal Hizmetler Müdürlüğü yetkilileri Özellikle korona virüs sürecinde tarımın toprağın sağlıklı gıdaya erişimin önemini bir kere anladık,40
